Name, Tagged Content, Tagged Guidance Content
"Education, training and skills", 132, 3
"School curriculum", 57, 2
"Primary curriculum, key stage 1", 60, 5
"Tests", 98, 51
"Phonics", 91, 47
"Assessments", 127, 62
"Science", 8, 2
"Maths", 16, 3
"English", 17, 2
"Programmes of study", 0, 0
"Exam regulation and administration", 362, 61
"Secondary curriculum, key stage 3 and key stage 4 (GCSEs)", 121, 12
"GCSE changes and reforms", 131, 14
"Key stage 3 and 4 exam marking, qualifications and results", 238, 39
"GCSE subject content and requirements", 149, 45
"Spiritual, moral, social and cultural development", 33, 4
"Key stage 5 (AS and A Levels)", 43, 14
"AS and A level subject content and requirements", 173, 59
"Key stage 5 exam marking, qualifications and results", 160, 14
"AS and A level changes and reforms", 108, 13
"Personal, social, health and economic education", 21, 1
"Primary curriculum, key stage 2", 61, 4
"Maths", 23, 3
"English", 17, 3
"Assessments", 182, 87
"Tests", 148, 75
"Science", 12, 2
"Programmes of study", 16, 14
"Early years curriculum", 103, 27
"Running and managing a school", 234, 79
"Careers guidance in schools", 25, 2
"School food, accommodation, transport and uniform", 29, 12
"Setting up or changing the status of a school", 195, 75
"School planning", 28, 15
"School to school support", 38, 9
"School trips and extracurricular activity", 11, 1
"School admissions", 41, 13
"School governance", 51, 26
"Recruiting and managing non-teaching school staff", 23, 6
"School complaints and whistleblowing", 10, 7
"Data collection for pupil data and school censuses", 173, 155
"School buildings and land", 28, 16
"School buildings and land transactions", 7, 6
"School buildings and land guidelines", 40, 35
"Further and higher education, skills and vocational training", 352, 42
"Inspection and performance of further education providers", 67, 5
"Inspection of further education and skills providers", 73, 19
"Inspection of residential provision in further education colleges", 8, 6
"Further education intervention notices and reports", 5, 2
"Student performance in further education", 8, 0
"Further education provider performance measures", 34, 23
"Performance data and Ofsted reports of further education providers", 29, 1
"Running a further or higher education institution", 56, 39
"Further and higher education courses and qualifications", 80, 42
"Further education financial management and data collection", 7, 5
"Data collection for further education providers", 26, 20
"Financial management for further education providers", 23, 19
"Local authority further education financial reporting and assurance", 8, 8
"Adult and community learning", 31, 13
"Careers guidance in further and higher education", 24, 9
"Education in prisons", 14, 6
"Apprenticeships, traineeships and internships", 145, 11
"Apprenticeship skills and standards", 278, 268
"Employers and training organisations", 57, 32
"Traineeships", 13, 8
"Internships", 7, 2
"Being an apprentice", 12, 9
"Types of apprenticeships", 128, 112
"Learning Records Service (LRS)", 18, 15
"Further education funding", 161, 122
"Further education building and premises", 10, 9
"Dance and drama funding for 16 to 19 year olds", 3, 2
"European Social Fund (ESF) and skills funding", 12, 8
"Free meals for 16 to 18 year olds", 4, 3
"Further education funding data", 52, 22
"Support for education work in other countries", 9, 0
"Pupil wellbeing, behaviour and attendance", 48, 4
"Pupil mental health and wellbeing", 35, 4
"Health and safety in schools", 13, 8
"School discipline and exclusions", 43, 10
"School attendance and absence", 62, 6
"Alternative provision and pupil referral units", 28, 7
"School bullying", 20, 3
"Safeguarding pupils", 188, 63
"School inspections and performance", 182, 24
"Inspection of local authority support for schools", 49, 6
"Inspection of maintained schools and academies", 114, 21
"School performance measures", 31, 14
"Inspection of independent schools", 42, 22
"Inspection of boarding and residential schools", 24, 21
"Pupil performance in schools", 34, 1
"School performance tables and Ofsted reports", 125, 13
"Academy intervention notices and reports", 195, 1
"Inspection of non-maintained schools", 1, 1
"Inspection of British schools overseas", 7, 4
"Education and funding for high needs, special educational needs and disability (SEND)", 110, 6
"Special educational needs and disability (SEND) code of practice", 22, 14
"Funding for special educational needs and disability (SEND)", 38, 12
"High needs funding", 47, 37
"Special educational needs and disability (SEND) support in education", 50, 12
"School and academy funding and provision", 141, 26
"Local authority schools funding", 55, 25
"Pupil premium and other school premiums ", 54, 26
"Funding for different types of schools and settings", 28, 13
"Alternative provision funding", 7, 3
"Faith schools funding", 6, 0
"Special schools funding", 9, 7
"Academy funding", 75, 49
"Early years funding", 41, 23
"Funding for 16 to 19 year olds in schools", 44, 32
"Schools forums", 4, 2
"Funding for school buildings and land", 95, 39
"Initial Teacher Training funding", 21, 21
"School places and capacity", 88, 7
"School Direct funding", 13, 11
"Free school meals (FSM) funding ", 14, 8
"Teaching and leadership", 64, 0
"Teacher training and professional development", 120, 29
"Initial Teacher Training (ITT)", 118, 38
"Teacher training providers", 33, 14
"School leadership", 71, 1
"National Professional Qualification for Headship (NPQH)", 2, 2
"Qualified Teacher Status (QTS)", 10, 4
"Subject Knowledge Enhancement (SKE)", 20, 10
"Recruiting and managing teachers", 45, 20
"Teacher pay, pensions and conditions", 90, 6
"Teacher records", 2, 2
"Teaching standards, misconduct and practice", 630, 19
"Funding and finance for students", 7, 7
"Financial help for students who are parents or carers", 7, 6
"Student loans, bursaries, and sponsorship", 32, 24
"Financial help for international students in the UK", 2, 0
"School and academy financial management and assurance", 13, 1
"Financial management, reporting and assurances for 16 to 19 year olds funding", 29, 20
"Academy and academy trust finance and reporting", 81, 52
"School procurement", 27, 22
"Local authority schools financial reporting and assurance", 46, 29
"School insurance and risk management", 6, 4
"Education of disadvantaged children", 63, 5
